,Titles,Author,Date
344,Why Verizon's Stock Plunged 7.5% Today,Travis Hoium,2023-07-17
329,Aehr Test Systems' Earnings Call: 2 Key Things Investors Should Know,Beth McKenna,2023-07-17
330,1 Thing Smart Investors Know About SoFi Stock,"Parkev Tatevosian, CFA",2023-07-17
331,Best Dividend Stocks to Buy: Ford vs. AT&T,"Parkev Tatevosian, CFA",2023-07-17
332,Why Telecom Stocks Missed Monday's Market Rally,Dan Caplinger,2023-07-17
333,Best EV Stocks: Nio vs. XPeng vs. Li Auto,"Parkev Tatevosian, CFA",2023-07-17
334,"Believe it or Not, Bus Travel is Back",The Daily Upside,2023-07-17
335,"Mr. Kerry Goes to Beijing Amid China's Hotter Climate, Cooler Economy",The Daily Upside,2023-07-17
343,Why Stagwell Stock Leaped Almost 11% Higher Today,Eric Volkman,2023-07-17
337,Why Artificial Intelligence (AI) Stock C3.ai Crushed the Market Today,Eric Volkman,2023-07-17
338,Best Growth Stocks to Buy: Cloudflare vs. Confluent,"Parkev Tatevosian, CFA",2023-07-17
339,Is Intel Coming for Nvidia in This Key Market?,Jose Najarro,2023-07-17
340,Great News for Domino's Stock and Uber Stock Investors,"Parkev Tatevosian, CFA",2023-07-17
341,Best AI Stocks to Buy: Palantir vs. Tesla vs. Microsoft,"Parkev Tatevosian, CFA",2023-07-17
342,Why Alnylam Pharmaceuticals Topped the Market Today,Eric Volkman,2023-07-17
336,EU Commission Turns Antitrust Eye on Microsoft Teams,The Daily Upside,2023-07-17
227,Cathie Wood Goes Bargain Hunting: 3 Stocks She Just Bought,Rick Munarriz,2023-07-18
226,Better AI Biotech Stock: Schrödinger vs. Recursion Pharmaceuticals,Alex Carchidi,2023-07-18
225,Half of Americans Think They'll Be in Debt for Up to 5 Years. Here's How to Break the Cycle Sooner,Maurie Backman,2023-07-18
224,Want Safe Income? This Stock Raised Its Dividend in the Last 8 Recessions,Marc Rapport,2023-07-18
223,The Retirement Mistake That Costs 4 in 10 People Thousands of Dollars,Justin Pope,2023-07-18
222,Should You Buy This Dividend-Growth Machine for Your Portfolio?,Kody Kester,2023-07-18
219,"Barry Diller Suggests 25% Hollywood Pay Cuts: Are Netflix, Disney, and Warner Brothers in Trouble?",Anders Bylund,2023-07-18
220,Why This Gambling Stock May Be Worth Rolling the Dice On,Adam Spatacco,2023-07-18
228,"Coca-Cola Stock: Buy, Sell, or Hold?",Stefon Walters,2023-07-18
218,Why Delta Air Lines Stock Is a Strong Buy Post-Earnings,Lee Samaha,2023-07-18
217,Is It Too Late to Buy Rapid7 Stock?,Leo Sun,2023-07-18
216,Here's How Realty Income Can Afford Its 5% Dividend Yield,"Brent Nyitray, CFA",2023-07-18
221,2 Top Warren Buffett Stocks to Buy Right Now,Anders Bylund,2023-07-18
229,Compounding Your Wealth Through Dividends,"Mark Roussin, CPA",2023-07-18
236,What These 2 Big Bank Stocks Are Saying About the Bull Market,Dan Caplinger,2023-07-18
234,"Microsoft Announces New Cybersecurity Products, but Are Small Security Software Stocks Really in Trouble?",Nicholas Rossolillo,2023-07-18
235,Should You Tap Your Retirement Fund to Pay Off a HELOC?,Maurie Backman,2023-07-18
215,Why Applied Materials Is One of the Top Semiconductor Stocks to Own,Jose Najarro and Billy Duberstein,2023-07-18
237,The Trade Desk Stock Has Absolutely Skyrocketed. Time to Sell?,Daniel Sparks,2023-07-18
238,Etsy Shrinks Its House of Brands by Dumping Elo7,Timothy Green,2023-07-18
239,4 Lessons From My First 100-Bagger,Gilbert Symington,2023-07-18
240,Here's What Happens When You Make a Higher Down Payment on a Home,Maurie Backman,2023-07-18
241,Are Stimulus Payments Gone for Good?,Maurie Backman,2023-07-18
242,How I Lived Rent-Free for a Month at a Resort Beach,Chris Neiger,2023-07-18
243,2 Bargain-Basement Stocks to Buy With No Hesitation,Matthew DiLallo,2023-07-18
244,Is It Too Late to Buy Opera Limited Stock?,Leo Sun,2023-07-18
245,Is PubMatic Stock a Buy Now?,Robert Izquierdo,2023-07-18
246,How to Know When It's Time to Refinance Your Home,Dana George,2023-07-18
247,Here's What Happens When Your Emergency Fund Is Too Big,Steven Porrello,2023-07-18
233,2 Cathie Wood Growth Stocks That Could Make You Richer,George Budwell,2023-07-18
214,2 Dividend-Paying Tech Stocks to Buy Right Now,Anders Bylund,2023-07-18
211,2 Top AI Stocks Ready for a Bull Run,Harsh Chauhan,2023-07-18
212,Verizon and AT&T: Time to Be Greedy or Is the Dividend at Risk?,Neil Rozenbaum,2023-07-18
175,Why Novartis Stock Spiked Today,George Budwell,2023-07-18
176,Why Visa Stock Was Down Today,Dave Kovaleski,2023-07-18
177,I Keep Part of My Emergency Fund in a CD. Here's Why,Maurie Backman,2023-07-18
178,Why Microsoft Rallied to an All-Time High Today,Billy Duberstein,2023-07-18
179,Why Charles Schwab Stock Surged 12% on Tuesday,Rich Smith,2023-07-18
180,Is Iger Really Breaking Up Disney?,Travis Hoium,2023-07-18
181,We Considered Selling Our Home. Here Are 3 Financial Reasons Why We're Going to Wait,Natasha Gabrielle,2023-07-18
182,Why Shares of Cabaletta Bio Are Up Tuesday,Jim Halley,2023-07-18
183,Dollar Tree Is Cutting Some Prices Back to $1 -- but Don't Get Too Excited Yet,Dana George,2023-07-18
187,The Surprising Reason You May Want to Cancel Amazon Prime,Maurie Backman,2023-07-18
188,Cathie Wood Crushed the Market in the First Half. Here's How You Can Follow Her Lead.,Adria Cimino,2023-07-18
189,"Why Shares of Bank of America, Morgan Stanley, and PacWest Bancorp Are Rising Today",Bram Berkowitz,2023-07-18
190,This Blue Chip Insurance Stock Plummeted 13% In 1 Day: Should Investors Be Concerned?,Courtney Carlsen,2023-07-18
191,Why Prologis Stock Was Slipping Today,Jeremy Bowman,2023-07-18
192,Why Shares of Masimo Are Dropping Tuesday,Jim Halley,2023-07-18
193,Pay Raises Beat Inflation for First Time in 2 Years. Is the End in Sight?,Emma Newbery,2023-07-18
194,Why Pinterest Stock Popped on Tuesday,Rich Smith,2023-07-18
248,"If You Invested $10,000 in BlackBerry in 2008, This Is How Much You Would Have Today",Leo Sun,2023-07-18
210,Got $4? This Hot Growth Stock Looks Like a Top Buy Right Now,Harsh Chauhan,2023-07-18
206,Why Rivian Stock Raced Higher Today,Scott Levine,2023-07-18
205,Why Shares of Acumen Pharmaceuticals Are Down Tuesday,Jim Halley,2023-07-18
204,Is Apple Stock a Buy?,Dani Cook,2023-07-18
203,Disney World's Top Rival Wants to Have a Blast This Summer,Rick Munarriz,2023-07-18
213,Here's What to Expect from the FTC's Investigation Into OpenAI,Jake Lerch,2023-07-18
202,Here's What Happens When Your Home Sits on the Market Too Long,Maurie Backman,2023-07-18
200,Is Costco Dropping Bud Light?,"Matthew Frankel, CFP®",2023-07-18
199,"Why Shares of Alibaba, JD.Com, and Tencent Are Falling Today",Bram Berkowitz,2023-07-18
198,"These 4 Travel Hacks Blew My Mind. They Could Save You Money, Too",Emma Newbery,2023-07-18
197,Why Teladoc Health Was Climbing Today,Jeremy Bowman,2023-07-18
196,1 Green Flag and 1 Red Flag for AI Stocks,Jake Lerch,2023-07-18
195,"Rivian's Roaring Ahead on Tuesday, but This Financial Stock Is Pure Money",Dan Caplinger,2023-07-18
201,1 in 10 Americans Think They'll Be in Debt for the Rest of Their Lives,Maurie Backman,2023-07-18
249,Be Careful With This Red-Hot AI Stock,Timothy Green,2023-07-18
252,Should You Buy This Thriving Dividend King Stock?,Kody Kester,2023-07-18
251,1 Monster Opportunity in the Global Chip Shortage,Stefon Walters,2023-07-18
293,3 Financial Stocks That Shine on the Bottom Line,Stefon Walters,2023-07-18
294,"2 Spectacular Growth Stocks That Could Turn $250,000 Into $1 Million by 2033",Anthony Di Pizio,2023-07-18
295,"Are Last Year's Stock Splits for Amazon, Google, and Tesla Paying Off Now?",Keith Speights,2023-07-18
296,"Disney's TV Business Is on the Chopping Block, According to CEO: What It Could Mean for the Company",James Brumley,2023-07-18
297,Cava Stock Has More Than Doubled Since Its IPO: Could It Make You Richer?,Justin Pope,2023-07-18
298,"Move Over, FAANG: 1 Unstoppable ""Magnificent 7"" Stock to Buy Hand Over Fist",Anthony Di Pizio,2023-07-18
302,Domino's Stock Is Down Over the Last 3 Years. Here's Why the Next 3 Years Should Be Better.,Jon Quast,2023-07-18
303,3 Warren Buffett Stocks That Everyone Should Own,Royston Yang,2023-07-18
304,Better Dividend Stock: IBM vs. HP,Leo Sun,2023-07-18
305,The Average American Has This Much Debt. How Does Yours Compare?,Maurie Backman,2023-07-18
306,1 Green Flag and 1 Red Flag For Medtronic,Adria Cimino,2023-07-18
307,Is It Too Late to Buy Eli Lilly Stock?,Cory Renauer,2023-07-18
308,JPMorgan Chase Shows Why It's the Best-Run Bank in the U.S.,Courtney Carlsen,2023-07-18
309,"This Supercharged Growth Stock Is Down 91%, and I Just Added It to My Portfolio -- Here's Why",Sean Williams,2023-07-18
292,1 Magnificent Growth Stock Down 39% You'll Regret Not Buying on the Dip,"Parkev Tatevosian, CFA",2023-07-18
310,The Next Chipotle? Here's Why Cava Is an Unstoppable Stock.,Danny Vena,2023-07-18
312,1 Thing Savvy Investors Know About Nikola Stock,"Parkev Tatevosian, CFA",2023-07-18
313,1 Crucial Factor Intelligent Investors Know About Palantir Stock,"Parkev Tatevosian, CFA",2023-07-18
314,Is It Too Late to Buy Canoo Stock?,Leo Sun,2023-07-18
315,The FTC Is Investigating OpenAI -- Here's the Worst Possible Outcome for Investors,Jeremy Bowman,2023-07-18
316,3 Reasons to Buy Snowflake Stock Despite Its Valuation,Will Healy,2023-07-18
317,2 Top Growth Stocks to Buy Right Now and Hold for the Long Term,Justin Pope,2023-07-18
318,5 Charts That Suggest We're Witnessing an Epic Bear Market Rally,Sean Williams,2023-07-18
319,History Says the Stock Market Is Headed Higher in 2023: 2 Remarkable Growth Stocks to Buy Before the Bull Market Begins,Trevor Jennewine,2023-07-18
320,The 1 Social Security Conversation All Married Couples Should Have,Maurie Backman,2023-07-18
321,4 Signs You Need to Upgrade Your Credit Card,Lyle Daly,2023-07-18
325,Here's What Happens to Your Salary When You Change Careers,Maurie Backman,2023-07-18
326,"1 Spectacular Growth Stock That Could Join Apple, Microsoft, Amazon, and Others in the $1 Trillion Club","Parkev Tatevosian, CFA",2023-07-18
327,Best Dividend Stocks to Buy: 3M vs. Deere,"Parkev Tatevosian, CFA",2023-07-18
328,"What Does Tesla's Charging Deal With Ford, GM, and Rivian Mean for ChargePoint Stock?","Parkev Tatevosian, CFA",2023-07-18
311,"2 Beaten-Down Growth Stocks That Could Turn $200,000 Into $1 Million by 2033",Cory Renauer,2023-07-18
250,Planning to Pass On Wealth to Your Grandchildren? 4 Things to Do Now,Marc Rapport,2023-07-18
291,Huge News for Canoo Stock Investors,"Parkev Tatevosian, CFA",2023-07-18
289,Why Is Everyone Talking About Lucid Stock Right Now?,"Parkev Tatevosian, CFA",2023-07-18
256,A Bull Market Is Coming: 1 Incredible Growth Stock Down 34% to Buy Now and Hold Forever,Keith Noonan,2023-07-18
257,Alibaba Is Trading Close to Its Lowest Valuation Ever -- Here's Why,Lawrence Nga,2023-07-18
258,2 Stocks Down 85% With Massive Upside,Keithen Drury,2023-07-18
259,2 High-Powered Stocks to Buy to Cash In on This Unstoppable Force,Matthew DiLallo,2023-07-18
174,Why Uber Stock Popped on Tuesday,Eric Volkman,2023-07-18
261,Watch Out: Cava Stock Could Crash by 70% or More,Timothy Green,2023-07-18
262,Ball Aerospace Is for Sale. How Much Is It Worth?,Rich Smith,2023-07-18
263,Home Equity Loan or Personal Loan? Which Is Best for You?,Dana George,2023-07-18
264,3 Signs You Should Ditch Your Costco Membership and Join Sam's Club Instead,Maurie Backman,2023-07-18
265,3 No-Brainer Stocks to Buy Right Now for Less Than $90,Jeff Santoro,2023-07-18
266,2 Things the Smart Investors Know About Roku Stock,Lawrence Nga,2023-07-18
267,SoFi Stock Is Soaring but There's a Bigger Question to Ask,Neil Rozenbaum,2023-07-18
268,These 2 Underappreciated Mini-Berkshires Are Absolute Bargains,Gilbert Symington,2023-07-18
269,Better Dividend Stock to Buy: Verizon vs. Coca-Cola,"Parkev Tatevosian, CFA",2023-07-18
290,Social Security: 2 Sneaky Ways You Could Be Missing Out on Benefits,Katie Brockman,2023-07-18
270,"With ChatGPT Under FTC Scrutiny, It's Time to Bet on Safer AI",Timothy Green,2023-07-18
272,Here's What Happened When I Referred My Parents for the Chase Sapphire Preferred Card,Margo Winton Parodi,2023-07-18
273,This Discounted Stock Is the Cheapest It's Been in Years,Keithen Drury,2023-07-18
274,Huge News for Amazon Stock Investors,"Parkev Tatevosian, CFA",2023-07-18
275,Nvidia Just Invested $50 Million in This Biotech -- Should You Buy It?,Alex Carchidi,2023-07-18
279,Should Bank Investors Worry About a Commercial Real Estate Crisis?,"Matthew Frankel, CFP®",2023-07-18
280,3 Under-the-Radar Tech Stocks to Buy In 2023,Jeff Santoro,2023-07-18
281,5 Semiconductor Equipment Stocks to Buy as the Chip Market Is Poised to Rebound,Jose Najarro and Billy Duberstein,2023-07-18
282,3 Great Dividend Stocks You Can Buy for Less Than $50,Collin Brantmeyer,2023-07-18
283,Warren Buffett's Investing Advice Could Make You a Stock Market Millionaire,Trevor Jennewine,2023-07-18
284,Where Will Palantir Technologies Be in 3 Years?,Leo Sun,2023-07-18
285,Apple vs. Microsoft: Which Is the Better Dividend Stock?,Daniel Sparks,2023-07-18
286,Here's What Happens When You Keep Your Emergency Fund in a CD,Maurie Backman,2023-07-18
287,"I Could Afford an Extra $1,000 a Month in Mortgage Payments. Here's Why I'm Staying Put",Maurie Backman,2023-07-18
288,4 Growth Stocks Ready to Make a Comeback,Jose Najarro,2023-07-18
271,3 Expert Tips to Pay Off Your Student Loans Within the Decade,Maurie Backman,2023-07-18
260,Is a Living Trust the Most Financially Savvy Way to Pass Inheritance to Your Family?,Marc Rapport,2023-07-18
173,Here's What Happens When You Put Off Pet Insurance for Too Long,Maurie Backman,2023-07-18
171,Why Netflix Stock Zoomed Almost 6% Higher Today,Eric Volkman,2023-07-18
159,"7 Remarkable Stocks That Could Join Apple, Microsoft, Nvidia, Amazon, and Alphabet in the $1 Trillion Club",Eric Cuka,2023-07-18
160,Why Enovix Stock Topped the Market on Tuesday,Eric Volkman,2023-07-18
164,These 2 Dow Stocks Led the Market Higher Tuesday,Dan Caplinger,2023-07-18
165,The US Housing Market is Nearly Non-Existent,The Daily Upside,2023-07-18
172,Why MongoDB Shares Rallied Today,Billy Duberstein,2023-07-18
167,This Year's Biggest Startup is a $1.85 Billion Hedge Fund,The Daily Upside,2023-07-18
168,Why UnitedHealth Stock Shot Higher on Tuesday,Eric Volkman,2023-07-18
169,Why Transocean Stock Triumphed on Tuesday,Eric Volkman,2023-07-18
170,Graham Stephan Believes This Is the 'Worst' Financial Mistake Young People Make. Is He Right?,Lyle Daly,2023-07-18
166,The UK Is Going Big on Small Nuclear Reactors,The Daily Upside,2023-07-18
58,Is This Recent IPO Stock the Next Starbucks or Chipotle?,Eric Volkman,2023-07-19
57,"Wayfair Stock: Buy, Sell, or Hold?",Demitri Kalogeropoulos,2023-07-19
56,Here's My Top Growth Stock to Buy Right Now,Stefon Walters,2023-07-19
55,Getting a Divorce? This Is What Will Happen to Your Retirement Accounts,Dana George,2023-07-19
54,Here's How Tanger Can Afford Its 4.3% Dividend Yield,"Brent Nyitray, CFA",2023-07-19
53,Microsoft's New AI Subscription May Actually Live Up to the Hype,Daniel Sparks,2023-07-19
50,Should You Buy the 3 Highest-Paying Dividend Stocks in the Dow Jones?,Reuben Gregg Brewer,2023-07-19
51,Warren Buffett Is Selling Activision Stock Before the Microsoft Acquisition Closes. Should You?,Keith Speights,2023-07-19
49,ASML Reported a Beat and Raised Guidance. Why Is the Stock Down?,Neil Rozenbaum,2023-07-19
45,"Carnival Cruise Lines: Buy, Sell, or Hold?",Rick Munarriz,2023-07-19
59,Microsoft Plans to Charge Big for AI. Will Users Pay?,Danny Vena,2023-07-19
44,2 Top Dividend Stocks You Can Buy and Hold Forever,Royston Yang,2023-07-19
43,This Is Why I'm Not All-In on Stocks,Chuck Saletta,2023-07-19
52,2 Growth Stocks Wall Street Analysts Think Can Double in Value,David Jagielski,2023-07-19
60,Better Cybersecurity Stock: CyberArk vs. Tenable,Leo Sun,2023-07-19
65,The 4 Top Financial Priorities for People in Their 40s and 50s,David Chang,2023-07-19
62,"If a New Bull Market Is Coming, Don't Make These 3 Expensive Mistakes",Marc Rapport,2023-07-19
63,"Here's How I'd Invest $10,000 Today",David Jagielski,2023-07-19
64,Chipotle to Open in the Middle East: Could This Magnificent Growth Stock Skyrocket Even More?,Jon Quast,2023-07-19
42,Why Nvidia Stock Jumped on Tuesday After Microsoft Announced New AI Solutions,Jose Najarro,2023-07-19
66,Here's How to Fix Your Credit Mistakes,Dana George,2023-07-19
67,America's Richest Families Are Changing Up Their Investments. Here's Why,David Chang,2023-07-19
68,Is Zillow the Best Housing Stock?,Travis Hoium,2023-07-19
72,"Prediction: These 2 Growth Stocks Will Join Apple, Amazon, Alphabet, Nvidia, and Microsoft in the $1 Trillion Club",Trevor Jennewine,2023-07-19
73,Is It Time to Buy the Dow Jones' 3 Worst-Performing Stocks This Year?,Jeremy Bowman,2023-07-19
74,"You Can't Control Dividend Cuts, but You Can Control What You Do About Them",Dave Kovaleski,2023-07-19
75,How to Calculate the Amount of Money You'll Need in Retirement,Dave Kovaleski,2023-07-19
76,Here's What Happens When You Refinance a Mortgage With Poor Credit,Maurie Backman,2023-07-19
77,3 Signs You're Throwing Money Away on Amazon Prime,Maurie Backman,2023-07-19
78,Rubber Hits the Road at Fisker,Travis Hoium,2023-07-19
61,2 AI Stocks Wall Street Loves,Anders Bylund,2023-07-19
41,Global-e Online: A Growth Stock With a Bright Future,Rob Starks Jr,2023-07-19
36,Why Amarin Stock Is Sinking Today,Keith Speights,2023-07-19
39,Toast Stock Plunges After It Eliminates Controversial Fee,Jon Quast,2023-07-19
15,The 2 Mega-Cap Stocks You Should Really Be Watching Wednesday,Dan Caplinger,2023-07-19
14,"Why Shares of U.S. Bancorp, Northern Trust, and KeyCorp Are Rising Today",Bram Berkowitz,2023-07-19
13,Why Virgin Galactic Stock Took Off Today,Rich Smith,2023-07-19
12,Why ASML Holdings Fell Today,Billy Duberstein,2023-07-19
11,Netflix's Cheapest Ad-Free Plan Is No Longer Available to New Subscribers,Natasha Gabrielle,2023-07-19
10,Renting a Car Through Costco Travel? Don't Miss This Free Perk,Natasha Gabrielle,2023-07-19
16,Why Salesforce Rallied Today,Billy Duberstein,2023-07-19
9,Why Carvana Stock Skyrocketed Today,Gilbert Symington,2023-07-19
7,Why Is Tesla Stock Down After Earnings? Is TSLA Stock a Buy Now?,Eric Cuka,2023-07-19
6,Chinese Fast-Fashion Rivals Take Their US Market Fight to Court,The Daily Upside,2023-07-19
5,Blackstone Races Toward $1 Trillion Milestone,The Daily Upside,2023-07-19
4,Goldman Sachs' Profit Plunge Confirms a Woeful Consumer Strategy,The Daily Upside,2023-07-19
2,2 Supercharged Dividend Growth Stocks Worth Buying Right Now,George Budwell,2023-07-19
1,Better Pharma Buy: Viatris vs. Pfizer,Adria Cimino,2023-07-19
8,Why Lemonade Stock Jumped Today,Jeremy Bowman,2023-07-19
40,These 2 Stocks Are Soaring Wednesday Morning,Dan Caplinger,2023-07-19
17,Teachers Can Get 60% Off a Sam's Club Membership Through Aug. 17,Natasha Gabrielle,2023-07-19
19,The Federal Reserve Has Paused Rate Hikes. Here's What That Means for Home Equity Loan Borrowers,Maurie Backman,2023-07-19
38,"2 Super Stocks That Could Join Apple, Microsoft, Nvidia, Alphabet, and Amazon in the $1 Trillion Club","Keith Noonan and Parkev Tatevosian, CFA",2023-07-19
37,S&P 500 Bear Market: Time to Buy These Market-Beating Growth Stocks,Demitri Kalogeropoulos,2023-07-19
79,Is Biogen Stock a Buy Now?,Prosper Junior Bakiny,2023-07-19
35,Why Lucid Stock Charged Higher Today,Scott Levine,2023-07-19
34,Hey Roku Investors: Celebrate the Price Hikes,Rick Munarriz,2023-07-19
33,How Much Should Costco's $1.50 Hot Dog and Soda Combo Really Cost Based on Inflation?,Maurie Backman,2023-07-19
18,"Why AT&T, Verizon, and Frontier Stocks All Bounced Back on Wednesday",Rich Smith,2023-07-19
32,"4 Reasons a Housing Market Crash Is Actually Unlikely, According to Harvard Researchers",Dana George,2023-07-19
30,Why Lumen Stock Is Rocketing Higher Today,Keith Noonan,2023-07-19
29,Why Bluebird Bio Stock Is Taking Flight Today,George Budwell,2023-07-19
28,Why Rivian Stock Powered Higher Today,Scott Levine,2023-07-19
27,Why Shares of ImmunityBio Were Up on Wednesday,Jim Halley,2023-07-19
26,"4 Side Hustles That Could Make You an Extra $10,000 by the End of the Year",David Chang,2023-07-19
22,Why Archer Aviation and Joby Aviation Stocks Are Down Today,Lou Whiteman,2023-07-19
31,Why Shares of Harrow Health Are Jumping Wednesday,Jim Halley,2023-07-19
80,Is Nu Stock a Buy?,Jennifer Saibil,2023-07-19
85,Microsoft Stock Jumps After Company Announced Partnership With Meta and New AI Solutions,Jose Najarro,2023-07-19
82,"Got $5,000? These Are 2 of the Best Growth Stocks to Buy Right Now.",Bradley Guichard,2023-07-19
125,When Is the Right Time to Take Over Your Elderly Parents' Finances?,Barbara Eisner Bayer,2023-07-19
126,Are Barbie Dollars Driving Mattel Stock Higher? Here's the Surprising Answer.,Keith Speights,2023-07-19
127,Will Verizon Communications Be a Trillion-Dollar Stock by 2050?,Leo Sun,2023-07-19
128,Buy These 3 Supercharged Stocks While They're Still Absurdly Cheap,Jennifer Saibil,2023-07-19
129,Is Enphase Stock Really Too Cheap to Ignore Right Now?,Nicholas Rossolillo,2023-07-19
130,Where in the World is W. P. Carey's Portfolio?,Reuben Gregg Brewer,2023-07-19
131,2 Energy Stocks That Could Lead the Next Bull Market,Reuben Gregg Brewer,2023-07-19
132,Where Will Pinterest Stock Be in 5 Years?,James Brumley,2023-07-19
133,"5 Super Easy Strategies to Save $10,000 Fast",Natasha Gabrielle,2023-07-19
134,Biden's Backup Student Loans Plan: How Long Could His Plan B Take?,Keith Speights,2023-07-19
135,Best Cathie Wood Stock to Own: Tesla vs. Twilio,"Parkev Tatevosian, CFA",2023-07-19
136,Prediction: This Beaten-Down Stock Will Be a Biotech Giant by 2030,Adria Cimino,2023-07-19
137,2 Dividend Stocks That Doubled Their Payouts in 5 Years,David Jagielski,2023-07-19
141,A Bull Market Is Coming: 2 Growth Stocks Down 15% and 30% to Buy Right Now,Keith Noonan,2023-07-19
142,Is It Too Late to Buy AMD Stock?,Will Healy,2023-07-19
143,3 No-Brainer Stocks to Buy With $400 Right Now,Sean Williams,2023-07-19
144,1 Artificial Intelligence Stock You Can Buy and Hold for the Next Decade,Bradley Guichard,2023-07-19
158,Best Growth Stocks to Buy: Sonos vs. Fubo,"Parkev Tatevosian, CFA",2023-07-19
157,Bad News for Ford Stock and Rivian Stock Investors,"Parkev Tatevosian, CFA",2023-07-19
156,1 Factor Intelligent Investors Know About Carnival Stock,"Parkev Tatevosian, CFA",2023-07-19
155,ChargePoint Has Set Its Eyes on This $192 Billion Opportunity,"Parkev Tatevosian, CFA",2023-07-19
154,3 Reasons to Take Social Security at 62 -- and 1 Fantastic Reason to Wait,Katie Brockman,2023-07-19
153,Should You Take Out a Personal Loan to Help Support a Family Member?,Dana George,2023-07-19
124,2 Incredible Growth Stocks Up 61% and 52% to Buy Hand Over Fist,Rachel Warren,2023-07-19
152,4 Money Rules to Follow if You Want to Be a Millionaire,Christy Bieber,2023-07-19
150,Like Growing Dividend Income? This Blue Chip Stock Just Upped Its Payout by 6%,Kody Kester,2023-07-19
149,The Trade Desk Stock: Bear vs. Bull,Harsh Chauhan,2023-07-19
148,Why Is Disney Struggling? This Warren Buffett Quote Explains It Perfectly,Jeremy Bowman,2023-07-19
147,Is It Too Late to Buy Microsoft Stock?,Dani Cook,2023-07-19
146,64% of Americans Worry a Major Recession Is Imminent. Do This If You Feel the Same and Are Retiring Within 2 Years,Maurie Backman,2023-07-19
145,A Bull Market Could Be Here: 3 Reasons to Buy Topgolf Callaway Stock,John Ballard,2023-07-19
151,Wall Street Believes These High-Profile Stock-Split Stocks Can Lose Up to 91% of Their Value,Sean Williams,2023-07-19
81,3 Healthcare Stocks to Buy and Hold for the Next 10 Years,Prosper Junior Bakiny,2023-07-19
123,Is BlackRock Stock a Buy Right Now?,Kody Kester,2023-07-19
121,Medical Costs May Rise by $500 Million This Year Because of...Pickleball,David Chang,2023-07-19
83,4 Things I Wish I Knew When I Had a 515 Credit Score,"Robin Hartill, CFP®",2023-07-19
84,A Bull Market Is Coming: 2 AI Stocks to Buy and Hold for 10 Years,Prosper Junior Bakiny,2023-07-19
86,PepsiCo Just Raised Its Outlook Again: Time to Buy the Stock?,Demitri Kalogeropoulos,2023-07-19
87,"Charles Schwab Tops Q2 Estimates Thanks to Management Fees, Despite Interest Income",James Brumley,2023-07-19
88,Why I'm Not Worried About Verizon's 8%-Yielding Dividend,Matthew DiLallo,2023-07-19
89,This 4.1%-Yielding Dividend Stock Just Got a Whole Lot Safer,Matthew DiLallo,2023-07-19
90,"Why Do Student Loans Get So Out of Hand, and How Can I Avoid It?",Maurie Backman,2023-07-19
91,Best Dividend Stocks to Buy: Target vs. Costco,"Parkev Tatevosian, CFA",2023-07-19
95,3 Red-Hot Stocks to Profit From the Electrification of Everything Trend,Lee Samaha,2023-07-19
96,Better Buy: Tyson Foods vs. Beyond Meat,Timothy Green,2023-07-19
97,Can Shiba Inu Reach $1? This $589 Trillion Problem Stands In the Way,Anthony Di Pizio,2023-07-19
98,Will Ethereum Be a Trillion-Dollar Cryptocurrency by 2025?,Dominic Basulto,2023-07-19
99,3 Top Tech Stocks That Could Help Make You Rich by Retirement,Jennifer Saibil,2023-07-19
100,3 Ways to Make the Most of Your Next Target Trip,Maurie Backman,2023-07-19
101,Here's What Happens When You Keep Repairing an Aging Car,Maurie Backman,2023-07-19
102,There Is More to GitLab Than Artificial Intelligence. Here's Why.,Adam Spatacco,2023-07-19
103,Could BlackBerry Become the Next CrowdStrike?,Leo Sun,2023-07-19
120,This Is the One Big Thing Ramit Sethi Misses About the Rent vs. Buy Debate,Christy Bieber,2023-07-19
119,3 Stocks to Buy Now That Are Yielding 3.5% to 8.8%,Reuben Gregg Brewer,2023-07-19
118,2 Safe Dividend Stocks to Beat Inflation,Reuben Gregg Brewer,2023-07-19
114,Prediction: These Will Be 3 of the Most Valuable Stocks by 2050,Anthony Di Pizio,2023-07-19
113,5 Things Retirees Need to Know About Income Taxes on Social Security Benefits,"Matthew Frankel, CFP®",2023-07-19
112,"1 Warren Buffett ETF That Could Turn $200 Per Month Into $395,000",Katie Brockman,2023-07-19
