,Titles,Author,Date
122,1 Chart That Tells You All You Need to Know About Tilray Brands' Biggest Problem,David Jagielski,2023-07-19
111,2 Reasons Warren Buffett Would Really Hate Wayfair Stock,Jennifer Saibil,2023-07-19
109,The People Who Bought My Home Came Back for Concessions After the Contracts Were Signed. Here's What I Did,Dana George,2023-07-19
108,1 Growth Stock Down 7% to Buy Right Now,Demitri Kalogeropoulos,2023-07-19
107,There's a Massive Housing Shortage in the U.S. – Could This Be the Solution?,"Matthew Frankel, CFP®",2023-07-19
106,Don't Believe This Misconception About Working on Social Security,Maurie Backman,2023-07-19
105,Virgin Galactic Announces Next Flight,Travis Hoium,2023-07-19
104,Could This Be the Next Great AI Stock?,Keithen Drury,2023-07-19
110,1 Thing That Could Derail the AI Revolution,Timothy Green,2023-07-19
0,"Tesla Earnings Rise, but Margins Continue to Drop: 7 Metrics You Should See",Beth McKenna,2023-07-19
